{
  "_format": "agenttool.polymorph-memetic-analogy/0.1",
  "analogy_id": "sha256:121bcdd439bf26ff237fd202c68fcc847602fdd79344e46f79eb94dc9f18df3c",
  "effect": "none",
  "mappings": [
    {
      "boundary": "molecular identity is retained in polymorphism; semantic identity is not inferred across meme variants",
      "key": "state_or_variant",
      "memetic_shape": "one source-scoped expression variant",
      "polymorph_shape": "one source-scoped physical crystal form"
    },
    {
      "boundary": "a participant is never a process condition, host, vector, or substrate",
      "key": "named_condition_or_context",
      "memetic_shape": "named channel, network, ranking, audience, and observation context",
      "polymorph_shape": "named material and process conditions"
    },
    {
      "boundary": "no physical conversion, infection, adoption, semantic equivalence, inverse, or transitive route transfers",
      "key": "directed_witnessed_route",
      "memetic_shape": "a witnessed or explicitly authored copy, remix, translation, or reintroduction relation",
      "polymorph_shape": "a witnessed production or conversion route"
    },
    {
      "boundary": "popularity is not thermodynamic stability, truth, value, health, or worth",
      "key": "bounded_reachability",
      "memetic_shape": "bounded observation or reproduction of a variant in a named context",
      "polymorph_shape": "routine access to a form under named conditions"
    },
    {
      "boundary": "reappearance does not prove a shared mechanism, original cause, preserved meaning, or inevitable recurrence",
      "key": "changed_conditions_reappearance",
      "memetic_shape": "a variant observed or reproduced again in a changed context",
      "polymorph_shape": "a prior form reached again through changed material conditions"
    }
  ],
  "mechanism_transferred": false,
  "memetic_shift": {
    "_format": "agenttool.memetic-reachability-shift/0.1",
    "shift_id": "sha256:7a2df30cce1145c7833e455ad784c9f23bc8ef7ae040e5ab873255f45e1020aa"
  },
  "non_transfer": [
    "authority",
    "brain_damage",
    "causation",
    "cognition",
    "consent",
    "continuity",
    "dignity",
    "harm",
    "identity",
    "infectivity",
    "intent",
    "lattice_energy",
    "memory",
    "nucleation",
    "permission",
    "popularity_as_stability",
    "rate_constants",
    "truth",
    "value_or_goodness"
  ],
  "polymorph_shift": {
    "_format": "agenttool.polymorph-reachability-shift/0.1",
    "shift_id": "sha256:16805ab5fe34643d7085968a0d7dad62e7159838645611fc09c4846cfd2e73bd"
  },
  "relationship": "structural_route_shape_only"
}
